<?xml version="1.0" encoding="utf-8" ?>
<values xmlns:xsi="http://www.w3.org/2001/XMLSchema-instance" xsi:noNamespaceSchemaLocation="DataSchema.xsd">
  <Data>
    <ID>0</ID><Value>Pick a value</Value>
  </Data>
  <Data>
    <ID>1</ID><Value>FLEX1</Value>
  </Data>
  <Data>
    <ID>2</ID><Value>FLEX2</Value>
  </Data>
  <Data>
    <ID>3</ID><Value>LCD</Value>
  </Data>
  <Data>
    <ID>4</ID><Value>OBUS</Value>
  </Data>
  <Data>
    <ID>5</ID><Value>WSN</Value>
  </Data>
</values>





